{
  "$schema": "https://json-schema.org/draft/2020-12/schema",
  "title": "Curated Curriculum Module",
  "description": "A saved, reusable unit plan: an ordered selection of lessons from this repo, with optional review fragments attached. Consumed by the course hub (../Admin) to create Canvas modules.",
  "type": "object",
  "required": [
    "name",
    "slug",
    "topic_names",
    "assignments"
  ],
  "additionalProperties": false,
  "properties": {
    "name": {
      "type": "string",
      "description": "Human-readable module name, e.g. \"Computer Setup and Git Usage\""
    },
    "slug": {
      "type": "string",
      "pattern": "^[a-z0-9][a-z0-9-]*$",
      "description": "Kebab-case identifier. Must match the filename: _modules/<slug>.json"
    },
    "description": {
      "type": "string",
      "description": "One-paragraph summary of what this module covers"
    },
    "unit_number": {
      "type": "integer",
      "minimum": 0,
      "description": "Suggested unit number. The hub may override this at import time based on the target course's existing modules."
    },
    "points_per_assignment": {
      "type": "number",
      "minimum": 0,
      "description": "Base points per assignment, BEFORE unit scaling is applied"
    },
    "scale_factor": {
      "type": "number",
      "exclusiveMinimum": 0,
      "description": "Per-unit point multiplier (points × scale_factor^unit_number, smart-rounded). Hub default is 1.15."
    },
    "start_date": {
      "type": [
        "string",
        "null"
      ],
      "description": "Almost always null — start dates belong to course scheduling at import time, not the curated module"
    },
    "topic_names": {
      "type": "array",
      "minItems": 1,
      "items": {
        "type": "string"
      },
      "description": "Top-level topic folders the lessons are drawn from, in the order they were added. Used by the hub to build the Canvas module name."
    },
    "assignments": {
      "type": "array",
      "minItems": 1,
      "items": {
        "type": "object",
        "required": [
          "day",
          "title",
          "path",
          "_module"
        ],
        "additionalProperties": false,
        "properties": {
          "day": {
            "type": "integer",
            "minimum": 1,
            "description": "1-indexed day within the unit (from the topic's LESSONS.md)"
          },
          "duration": {
            "type": "number",
            "minimum": 0.5,
            "multipleOf": 0.5,
            "description": "Number of class periods this assignment spans (default 1). 0.5 pairs two assignments onto one class day — each carries a \"sub\" index and is named unit.day.0 / unit.day.1."
          },
          "sub": {
            "type": "integer",
            "minimum": 0,
            "maximum": 1,
            "description": "Sub-index within a shared half-day (duration 0.5 only): 0 for the first assignment of the day, 1 for the second. Assigned automatically by the Module Planner's renumbering."
          },
          "duration_override": {
            "type": "boolean",
            "description": "True when the teacher set this assignment's length in the Module Planner (the inline day-count dropdown), overriding the lesson's LESSONS.md duration. When absent, loading the module re-reads the duration from the repo."
          },
          "base_points": {
            "type": "number",
            "exclusiveMinimum": 0,
            "description": "This assignment's base points (the Module Planner's Points column), used instead of points_per_assignment (or, for a quiz row, the quiz's own points). Canvas sync multiplies it by scale_factor^unit like every other assignment. Absent = the default."
          },
          "no_assignment": {
            "type": "boolean",
            "description": "True when no homework is due for this day (the Planner's 'no HW' checkbox). Canvas sync creates an unpublished content Page (lesson README plus any attached reviews) instead of an assignment — no points, no due date."
          },
          "title": {
            "type": "string"
          },
          "path": {
            "type": "string",
            "description": "Lesson folder name inside the topic folder, e.g. \"RepositoriesAndCommits\". Empty string for a placeholder entry (see \"placeholder\")."
          },
          "_module": {
            "type": "string",
            "description": "Top-level topic folder the lesson lives in, e.g. \"GitUsage\". Named to match the hub's create-module payload. Empty string for a placeholder entry (see \"placeholder\")."
          },
          "placeholder": {
            "type": "boolean",
            "description": "True for an \"Additional Day\" stub inserted from the Module Planner that doesn't reference a real lesson yet (path/_module are empty strings). Skipped by lesson-existence checks; excluded from Canvas assignment creation until it references a real lesson and this flag is removed."
          },
          "kind": {
            "type": "string",
            "enum": [
              "page",
              "test",
              "quiz"
            ],
            "description": "Optional flag on a placeholder entry. \"page\": Canvas sync creates an unpublished Page (linked into the module) instead of an assignment — an in-class day with no homework. \"test\": the day number is reserved for a manually placed test; nothing is created on sync. \"quiz\": an in-class quiz whose content lives encrypted in the private Exams repo — \"quiz_id\" is required; sync creates an assignment carrying that id (or the real New Quiz when the teacher pushes it). Absent: plain Additional Day."
          },
          "quiz_id": {
            "type": "string",
            "pattern": "^[0-9a-f]{8,64}$",
            "description": "For \"kind\": \"quiz\" only. The opaque id from quiz.meta.json in the private Exams repo (<Class>/<Topic>/Quizzes/<slug>/). The link between this public repo and the encrypted quiz: the hub lists quizzes from the Exams checkout (EXAMS_DIR, default ../Exams) and matches this id."
          },
          "review": {
            "description": "Review fragment(s) to prepend to this assignment — a single reference (legacy saves), a list of references (multiple reviews stacked on one day, rendered as one block each in order), or null. Stored as references (not inline content) so the repo stays the single source of truth — the hub resolves them to markdown at import time.",
            "anyOf": [
              {
                "type": "null"
              },
              {
                "$ref": "#/$defs/reviewRef"
              },
              {
                "type": "array",
                "items": {
                  "$ref": "#/$defs/reviewRef"
                }
              }
            ]
          }
        }
      }
    },
    "updated": {
      "type": "string",
      "description": "ISO date (YYYY-MM-DD) of the last edit"
    }
  },
  "$defs": {
    "reviewRef": {
      "type": "object",
      "required": [
        "module",
        "path",
        "file"
      ],
      "additionalProperties": false,
      "properties": {
        "module": {
          "type": "string",
          "description": "Topic folder containing the review"
        },
        "path": {
          "type": "string",
          "description": "Lesson folder containing the review/ subfolder"
        },
        "file": {
          "type": "string",
          "pattern": "\\.md$",
          "description": "Filename inside the review/ folder"
        },
        "label": {
          "type": "string",
          "description": "Display label cached by the planner (the concept the review covers)"
        }
      }
    }
  }
}
