{
  "name": "web",
  "slug": "web",
  "description": "",
  "unit_number": 0,
  "points_per_assignment": 10,
  "scale_factor": 1.5,
  "start_date": null,
  "topic_names": [
    "WebProgramming"
  ],
  "assignments": [
    {
      "day": 1,
      "duration": 1,
      "title": "Website Hosting",
      "path": "WebsiteHosting",
      "_module": "WebProgramming",
      "review": null
    },
    {
      "day": 2,
      "duration": 1,
      "title": "Interfacing with AI",
      "path": "InterfacingWithAI",
      "_module": "WebProgramming",
      "review": null
    },
    {
      "day": 3,
      "duration": 0.5,
      "title": "JavaScript and Coding with Cursor",
      "path": "JavaScriptAndCursor",
      "_module": "WebProgramming",
      "review": null,
      "sub": 0,
      "duration_override": true
    },
    {
      "day": 3,
      "duration": 0.5,
      "title": "Debugging JavaScript",
      "path": "DebuggingJavaScript",
      "_module": "WebProgramming",
      "review": null,
      "sub": 1,
      "duration_override": true
    },
    {
      "day": 4,
      "duration": 2,
      "title": "The Learning Widget Project",
      "path": "LearningWidget",
      "_module": "WebProgramming",
      "review": null
    },
    {
      "day": 6,
      "duration": 1,
      "title": "Persistence and Intermediate Web",
      "path": "PersistenceAndIntermediateWeb",
      "_module": "WebProgramming",
      "review": null,
      "no_assignment": true
    },
    {
      "day": 7,
      "duration": 1,
      "title": "Databases and Collections",
      "path": "DatabasesAndCollections",
      "_module": "WebProgramming",
      "review": [
        {
          "label": "The Four-Command Round Trip",
          "module": "Terminal",
          "path": "Basics",
          "file": "four-command-round-trip.md"
        }
      ]
    },
    {
      "day": 8,
      "duration": 1,
      "title": "UX and Behavior Tracking",
      "path": "UXAndBehaviorTracking",
      "_module": "WebProgramming",
      "review": null
    },
    {
      "day": 9,
      "duration": 1,
      "title": "Widget Iteration from Feedback",
      "path": "WidgetIteration",
      "_module": "WebProgramming",
      "review": null
    },
    {
      "day": 10,
      "duration": 1,
      "title": "Collaborative Peer Review",
      "path": "PeerReview",
      "_module": "WebProgramming",
      "review": null
    }
  ],
  "updated": "2026-08-25"
}
