{
  "name": "U5 - AI Module",
  "slug": "u5-ai-module",
  "description": "",
  "unit_number": 4,
  "points_per_assignment": 10,
  "scale_factor": 1.15,
  "start_date": null,
  "topic_names": [
    "MiniGPT"
  ],
  "assignments": [
    {
      "day": 1,
      "duration": 1,
      "title": "Patterns Become Tokens",
      "path": "Tokenizer",
      "_module": "MiniGPT",
      "review": null
    },
    {
      "day": 2,
      "duration": 1,
      "title": "The Reader with One-Step Memory",
      "path": "MarkovBaseline",
      "_module": "MiniGPT",
      "review": null
    },
    {
      "day": 3,
      "duration": 1,
      "title": "The Hand-Built Spotlight",
      "path": "FixedAttention",
      "_module": "MiniGPT",
      "review": null
    },
    {
      "day": 4,
      "duration": 1,
      "title": "A Table That Learns",
      "path": "TrainableBigram",
      "_module": "MiniGPT",
      "review": null
    },
    {
      "day": 5,
      "duration": 1,
      "title": "From Exact Symbols to Features",
      "path": "ObjectNetwork",
      "_module": "MiniGPT",
      "review": null
    },
    {
      "day": 6,
      "duration": 2,
      "title": "Following the Error Backward",
      "path": "ScalarAutograd",
      "_module": "MiniGPT",
      "review": null
    },
    {
      "day": 8,
      "duration": 1,
      "title": "From Glass Box to Engine",
      "path": "DenseEngine",
      "_module": "MiniGPT",
      "review": null
    },
    {
      "day": 9,
      "duration": 1,
      "title": "Learning What to Look For",
      "path": "SingleHeadAttention",
      "_module": "MiniGPT",
      "review": null
    },
    {
      "day": 10,
      "duration": 1,
      "title": "A Team of Readers",
      "path": "TransformerBlock",
      "_module": "MiniGPT",
      "review": null
    },
    {
      "day": 11,
      "duration": 2,
      "title": "The Machine Writes",
      "path": "TrainingAndGeneration",
      "_module": "MiniGPT",
      "review": null
    },
    {
      "day": 13,
      "duration": 3,
      "title": "The Trial of the Archive",
      "path": "Capstone",
      "_module": "MiniGPT",
      "review": null
    }
  ],
  "updated": "2026-08-13"
}
