{
  "name": "Git Project",
  "slug": "git-project",
  "description": "Program Git",
  "unit_number": 2,
  "points_per_assignment": 120,
  "scale_factor": 1.15,
  "start_date": null,
  "topic_names": [
    "GitProject"
  ],
  "assignments": [
    {
      "day": 1,
      "duration": 1,
      "title": "Project Setup",
      "path": "ProjectSetup",
      "_module": "GitProject",
      "review": null
    },
    {
      "day": 2,
      "duration": 3,
      "title": "Initialization and Blobs",
      "path": "InitAndBlobs",
      "_module": "GitProject",
      "review": null
    },
    {
      "day": 5,
      "duration": 0.5,
      "title": "Git Project Part 2 — Initialization and Blobs: Quiz and Self-Assessment",
      "path": "",
      "_module": "",
      "review": null,
      "sub": 0,
      "placeholder": true,
      "kind": "quiz",
      "quiz_id": "ee92474635bc750d"
    },
    {
      "day": 5,
      "duration": 0.5,
      "title": "Peer Code Verification",
      "path": "PeerCodeVerification",
      "_module": "GitProject",
      "review": null,
      "sub": 1,
      "duration_override": true
    },
    {
      "day": 6,
      "duration": 3,
      "title": "Trees",
      "path": "Trees",
      "_module": "GitProject",
      "review": null
    },
    {
      "day": 9,
      "duration": 0.5,
      "title": "Git Project Part 3 — Trees: Quiz",
      "path": "",
      "_module": "",
      "review": null,
      "sub": 0,
      "placeholder": true,
      "kind": "quiz",
      "quiz_id": "004df05af92b7b74"
    },
    {
      "day": 9,
      "duration": 0.5,
      "title": "Peer Tree Verification",
      "path": "PeerTreeVerification",
      "_module": "GitProject",
      "review": null,
      "sub": 1,
      "duration_override": true
    },
    {
      "day": 10,
      "duration": 2,
      "title": "Commits",
      "path": "Commits",
      "_module": "GitProject",
      "review": null,
      "duration_override": true
    },
    {
      "day": 12,
      "duration": 1,
      "title": "Branches",
      "path": "Branches",
      "_module": "GitProject",
      "review": null
    }
  ],
  "updated": "2026-10-10"
}
