{
  "name": "Computer Setup and Git Usage",
  "slug": "computer-setup-and-git-usage",
  "description": "Environment setup followed by core Git workflows: install the toolchain, then learn repositories, commits, branching, merging, and fork-based collaboration.",
  "unit_number": 1,
  "points_per_assignment": 10,
  "scale_factor": 1,
  "start_date": null,
  "topic_names": [
    "ComputerSetup",
    "GitUsage"
  ],
  "assignments": [
    {
      "day": 1,
      "duration": 1,
      "title": "Initial Install",
      "path": "InitialInstall",
      "_module": "ComputerSetup",
      "review": null
    },
    {
      "day": 1,
      "duration": 1,
      "title": "Repositories and Commits",
      "path": "RepositoriesAndCommits",
      "_module": "GitUsage",
      "review": {
        "module": "Terminal",
        "path": "Basics",
        "file": "chained-terminal-operations.md",
        "label": "Chained Terminal Operations"
      }
    },
    {
      "day": 2,
      "duration": 1,
      "title": "Branching and Merging",
      "path": "BranchingAndMerging",
      "_module": "GitUsage",
      "review": null
    },
    {
      "day": 3,
      "duration": 1,
      "title": "Forks and Collaboration",
      "path": "ForksAndCollaboration",
      "_module": "GitUsage",
      "review": null
    }
  ],
  "updated": "2026-08-21"
}
