{
  "name": "Temp test uint",
  "slug": "temp-test-uint",
  "description": "",
  "unit_number": 0,
  "points_per_assignment": 10,
  "scale_factor": 1.15,
  "start_date": null,
  "topic_names": [
    "Terminal"
  ],
  "assignments": [
    {
      "day": 1,
      "duration": 1,
      "title": "Terminal Basics",
      "path": "Basics",
      "_module": "Terminal",
      "review": null
    }
  ],
  "updated": "2026-09-27"
}
